{
  "$schema": "../schemas/business-profile.schema.json",
  "profile": {
    "slug": "barberia",
    "name": "Barbería / Salón",
    "category": "servicios",
    "icon": "scissors",
    "version": 1,
    "primary_mode": "appointments",
    "description": "Negocio de servicios con agenda por profesional, comisiones por corte y venta cruzada de productos."
  },

  "modules": {
    "pos":            { "enabled": true,  "required": true, "layout": "service_first" },
    "inventory":      { "enabled": true,  "variants": false, "lots": false, "expiry": false, "serials": false,
                        "label": "Productos y consumibles" },
    "credit":         { "enabled": true,  "default_kind": "open_account" },
    "customers":      { "enabled": true,  "required": true },
    "loyalty":        { "enabled": true,  "default_program": "stamps" },
    "purchasing":     { "enabled": true },
    "expenses":       { "enabled": true },
    "cash":           { "enabled": true },
    "taxes":          { "enabled": true },
    "storefront":     { "enabled": true,  "checkout_mode": "whatsapp", "mode": "booking" },
    "appointments":   { "enabled": true,  "required": true },
    "tables":         { "enabled": false },
    "service_orders": { "enabled": false },
    "employees":      { "enabled": true,  "commissions": true, "attendance": true, "bookable": true },
    "agro":           { "enabled": false },
    "lending":        { "enabled": false }
  },

  "operation_modes": ["appointments", "quick_pos"],

  "uoms": [
    { "code": "UND", "name": "Unidad", "dimension": "unit", "factor_to_base": 1, "is_base": true, "precision": 0 },
    { "code": "SERV", "name": "Servicio", "dimension": "unit", "factor_to_base": 1, "precision": 0 },
    { "code": "ML", "name": "Mililitro", "dimension": "volume", "factor_to_base": 0.001, "precision": 0 },
    { "code": "L", "name": "Litro", "dimension": "volume", "factor_to_base": 1, "is_base": true, "precision": 3 }
  ],

  "categories": [
    { "slug": "cortes", "name": "Cortes", "color": "#0EA5E9", "icon": "scissors", "kind": "service" },
    { "slug": "barba", "name": "Barba y Afeitado", "color": "#8B5CF6", "icon": "razor", "kind": "service" },
    { "slug": "color", "name": "Color y Tratamientos", "color": "#EC4899", "icon": "palette", "kind": "service" },
    { "slug": "productos", "name": "Productos de Venta", "color": "#F59E0B", "icon": "package" },
    { "slug": "consumibles", "name": "Consumibles (uso interno)", "color": "#64748B", "icon": "spray" }
  ],

  "attributes": {
    "product": [
      {
        "key": "duration_min", "label": "Duración", "data_type": "integer",
        "ui_widget": "stepper", "ui_group": "Servicio", "unit_suffix": "min",
        "is_required": true, "default_value": 30, "show_in_pos": true, "position": 10,
        "validation": { "min": 5, "max": 480, "step": 5 },
        "applies_to_categories": ["cortes", "barba", "color"]
      },
      {
        "key": "buffer_min", "label": "Tiempo de limpieza", "data_type": "integer",
        "ui_widget": "stepper", "ui_group": "Servicio", "unit_suffix": "min",
        "default_value": 5, "position": 20,
        "applies_to_categories": ["cortes", "barba", "color"]
      },
      {
        "key": "skill_required", "label": "Nivel requerido", "data_type": "enum",
        "ui_widget": "segmented", "ui_group": "Servicio", "position": 30,
        "options": [
          { "value": "junior", "label": "Junior" },
          { "value": "senior", "label": "Senior" },
          { "value": "master", "label": "Master" }
        ]
      },
      {
        "key": "commission_pct", "label": "Comisión del profesional", "data_type": "percent",
        "ui_widget": "number", "ui_group": "Comercial", "unit_suffix": "%",
        "default_value": 40, "position": 40
      },
      {
        "key": "gender_target", "label": "Dirigido a", "data_type": "enum",
        "ui_widget": "segmented", "ui_group": "Servicio", "is_filterable": true, "position": 50,
        "options": [
          { "value": "hombre", "label": "Hombre" },
          { "value": "mujer", "label": "Mujer" },
          { "value": "nino", "label": "Niño" },
          { "value": "unisex", "label": "Unisex" }
        ]
      }
    ],
    "customer": [
      { "key": "tipo_cabello", "label": "Tipo de cabello", "data_type": "enum", "ui_widget": "select",
        "is_filterable": true, "position": 10,
        "options": [
          { "value": "liso", "label": "Liso" },
          { "value": "ondulado", "label": "Ondulado" },
          { "value": "rizado", "label": "Rizado" },
          { "value": "afro", "label": "Afro" }
        ] },
      { "key": "barbero_preferido", "label": "Profesional preferido", "data_type": "uuid_ref",
        "ui_widget": "select", "ref_entity": "employee", "position": 20 },
      { "key": "alergias", "label": "Alergias / sensibilidades", "data_type": "text",
        "ui_widget": "textarea", "position": 30 },
      { "key": "ultimo_corte_notas", "label": "Notas del último servicio", "data_type": "text",
        "ui_widget": "textarea", "position": 40 }
    ],
    "employee": [
      { "key": "especialidades", "label": "Especialidades", "data_type": "multi_enum",
        "ui_widget": "chips", "position": 10,
        "options": [
          { "value": "fade", "label": "Fade / Degradado" },
          { "value": "barba", "label": "Barba y afeitado" },
          { "value": "color", "label": "Color" },
          { "value": "keratina", "label": "Keratina / Alisado" },
          { "value": "infantil", "label": "Corte infantil" },
          { "value": "diseno", "label": "Diseños / Freestyle" }
        ] },
      { "key": "nivel", "label": "Nivel", "data_type": "enum", "ui_widget": "segmented", "position": 20,
        "options": [
          { "value": "junior", "label": "Junior" },
          { "value": "senior", "label": "Senior" },
          { "value": "master", "label": "Master" }
        ] }
    ]
  },

  "product_defaults": {
    "kind": "service",
    "track_inventory": false,
    "track_lots": false,
    "track_expiry": false,
    "is_sellable": true
  },

  "appointments": {
    "slot_minutes": 15,
    "advance_booking_days": 30,
    "min_notice_minutes": 30,
    "allow_online_booking": true,
    "require_deposit": false,
    "deposit_pct": 0,
    "no_show_policy": { "track": true, "block_after": 3 },
    "reminders": [
      { "offset_hours": -24, "channel": "whatsapp" },
      { "offset_hours": -2,  "channel": "whatsapp" }
    ],
    "resources": [{ "kind": "chair", "label": "Silla" }]
  },

  "ui": {
    "navigation": [
      { "key": "agenda",    "label": "Agenda",     "icon": "calendar",      "route": "/agenda", "primary": true },
      { "key": "pos",       "label": "Cobrar",     "icon": "shopping-cart", "route": "/pos" },
      { "key": "customers", "label": "Clientes",   "icon": "users",         "route": "/clientes" },
      { "key": "employees", "label": "Equipo",     "icon": "user-check",    "route": "/equipo" },
      { "key": "inventory", "label": "Productos",  "icon": "package",       "route": "/inventario" },
      { "key": "reports",   "label": "Reportes",   "icon": "bar-chart",     "route": "/reportes" }
    ],
    "pos": {
      "layout": "service_first",
      "primary_action": "select_service",
      "show_product_images": false,
      "show_stock_badge": false,
      "variant_selector": "none",
      "quick_filters": ["gender_target"],
      "keypad": "numeric",
      "require_customer": true,
      "require_employee_per_line": true,
      "allow_tip": true,
      "tip_presets": [0, 10, 15, 20]
    },
    "product_form": {
      "groups": ["Básico", "Servicio", "Comercial", "Precios"],
      "hidden_fields": ["track_lots", "track_expiry", "track_serials", "is_weighted", "age_restricted"]
    },
    "dashboard_widgets": [
      "appointments_today", "occupancy_rate", "revenue_by_barber",
      "commissions_pending", "top_services", "no_show_rate", "avg_ticket", "rebooking_rate"
    ]
  },

  "receipt": {
    "width_mm": 58,
    "show_attributes": ["duration_min"],
    "show_employee_name": true,
    "footer": "¡Gracias por tu visita! Reserva tu próxima cita por WhatsApp.",
    "show_qr_storefront": true
  },

  "roles": [
    { "code": "admin",   "name": "Administrador", "permissions": ["*"] },
    { "code": "barbero", "name": "Barbero/Estilista",
      "permissions": ["appointments.read_own", "appointments.update_own", "sales.create",
                      "customers.read", "customers.update", "attendance.clock", "commissions.read_own"],
      "constraints": { "scope": "own_appointments_only", "max_discount_pct": 0 } },
    { "code": "recepcion", "name": "Recepción",
      "permissions": ["appointments.*", "sales.create", "sales.read", "customers.*",
                      "cash.open", "cash.close", "credit.charge", "credit.collect"],
      "constraints": { "max_discount_pct": 15, "requires_supervisor_pin": ["sales.void"] } },
    { "code": "contador", "name": "Contador",
      "permissions": ["reports.*", "finance.read", "taxes.*", "expenses.*", "payroll.read"] }
  ],

  "automations": [
    { "key": "appointment_reminder", "enabled": true, "config": { "offsets_hours": [-24, -2], "channel": "whatsapp" } },
    { "key": "rebooking_nudge",      "enabled": true, "config": { "days_after_visit": 21, "channel": "whatsapp" } },
    { "key": "birthday_promo",       "enabled": true, "config": { "days_before": 3, "discount_pct": 20 } },
    { "key": "loyalty_stamps",       "enabled": true, "config": { "stamps_needed": 10, "reward": "corte_gratis" } },
    { "key": "commission_closeout",  "enabled": true, "config": { "frequency": "biweekly" } },
    { "key": "collection_reminder",  "enabled": true, "config": { "offsets_days": [-1, 5], "channel": "whatsapp" } }
  ],

  "reports": [
    "revenue_by_employee", "occupancy_by_hour", "service_mix",
    "commission_settlement", "customer_retention", "no_show_analysis", "product_attach_rate"
  ]
}
